ean,produto,title_found
7896547501390,BEB COQUETEL COROTE 500ml MENTA,Coquetel Corote Baunilha e Limão 500ml
7898080665010,BEB ENERGETICO BALY 2l MORANGO/PESSEGO,Energético Baly Melancia 2L
7896005404553,BEB MAGUARY TP 1l MACA,Suco Maguary Néctar Morango TP 1L
7896005404560,BEB MAGUARY TP 200ml MACA,Suco Maguary Maracujá TP 200ml
7896005404218,BEB MAGUARY TP 200ml UVA,Suco Maguary Maracujá TP 200ml
7896005404201,BEB SUCO MAGUARY TP 1l GOIABA,Suco Maguary Néctar Morango TP 1L
7891999941879,"BEB VIGOR TURMA 200ml, LARANJA",Suco de Maçã Turma da Mônica Vigor 200ml
7898280628075,BEB XAROPE PIACERI 690ml FRUTAS MORANGO,Xarope Piaceri Curaçau Frutas Vermelhas 690ml
7891962007366,BISC BAUDUCCO MAXI 25g CHOCOLATE,Biscoito Bauducco Maxi Sabor Baunilha 25g
7891000395509,CHOCO TRIO GAROTO BARRA 90g BONO MORANGO,Barra de Chocolate Nestlé Choco Trio BBB Avelã 90g
7622210696670,REFRESCO CLIGHT ZERO 8g UVA,Refresco em Pó Clight Zero Maracujá 8g
7896267104833,"REFRESCO PRO MIX 250g REND 10l, LIMAO",Suco Em Pó Promix Sabor Laranja Rende 10L 250g
7896267104840,"REFRESCO PRO MIX 250g REND 10l, MANGA",Suco Em Pó Promix Sabor Laranja Rende 10L 250g
7896267104857,"REFRESCO PRO MIX 250g REND 10l, MARACUJA",Suco Em Pó Promix Sabor Laranja Rende 10L 250g
7896267104888,"REFRESCO PRO MIX 250g REND 10l, UVA",Suco Em Pó Promix Sabor Laranja Rende 10L 250g
7897664171749,"SAB ALBANY MASC 80g, LARANJA",Sabonete Albany Frutas Vermelhas Barra 80g
7899572810857,"SH LOLA GHEE 250ml, NUTRI ABACAXI",Shampoo Lola Be(m)dita Ghee Hidratação Banana 250ml
7899706132985,"TINT CASTING, 670 CHOCO C/ PIMENTA",Tinta de Cabelos Casting Creme Gloss Chocolate com Pimenta 670
